{
  "$schema": "https://json-schema.org/draft/2020-12/schema",
  "$id": "https://light-cycles.local/schemas/lc-eval-1.schema.json",
  "title": "Light Cycles fixed evaluation report v1",
  "type": "object",
  "additionalProperties": false,
  "required": [
    "format",
    "run_id",
    "checkpoint_id",
    "protocol",
    "held_out_seeds",
    "matchups",
    "report_sha256"
  ],
  "properties": {
    "format": {
      "const": "lc-eval/1"
    },
    "run_id": {
      "$ref": "#/$defs/id"
    },
    "checkpoint_id": {
      "$ref": "#/$defs/id"
    },
    "protocol": {
      "const": "lc-eval/1"
    },
    "held_out_seeds": {
      "const": [
        "0",
        "1",
        "2",
        "3",
        "4",
        "5",
        "6",
        "7",
        "8",
        "9",
        "10",
        "11",
        "12",
        "13",
        "14",
        "15",
        "16",
        "17",
        "18",
        "19",
        "20",
        "21",
        "22",
        "23",
        "24",
        "25",
        "26",
        "27",
        "28",
        "29",
        "30",
        "31"
      ]
    },
    "matchups": {
      "type": "array",
      "minItems": 2,
      "maxItems": 2,
      "items": {
        "$ref": "#/$defs/matchup"
      }
    },
    "report_sha256": {
      "$ref": "#/$defs/sha256"
    }
  },
  "$defs": {
    "id": {
      "type": "string",
      "pattern": "^[A-Za-z0-9][A-Za-z0-9._:-]{0,127}$"
    },
    "sha256": {
      "type": "string",
      "pattern": "^[a-f0-9]{64}$"
    },
    "u64": {
      "type": "string",
      "pattern": "^(?:0|[1-9][0-9]{0,18}|(?:1[0-7][0-9][0-9][0-9][0-9][0-9][0-9][0-9][0-9][0-9][0-9][0-9][0-9][0-9][0-9][0-9][0-9][0-9][0-9]|18[0-3][0-9][0-9][0-9][0-9][0-9][0-9][0-9][0-9][0-9][0-9][0-9][0-9][0-9][0-9][0-9][0-9][0-9]|184[0-3][0-9][0-9][0-9][0-9][0-9][0-9][0-9][0-9][0-9][0-9][0-9][0-9][0-9][0-9][0-9][0-9]|1844[0-5][0-9][0-9][0-9][0-9][0-9][0-9][0-9][0-9][0-9][0-9][0-9][0-9][0-9][0-9][0-9]|18446[0-6][0-9][0-9][0-9][0-9][0-9][0-9][0-9][0-9][0-9][0-9][0-9][0-9][0-9][0-9]|184467[0-3][0-9][0-9][0-9][0-9][0-9][0-9][0-9][0-9][0-9][0-9][0-9][0-9][0-9]|1844674[0-3][0-9][0-9][0-9][0-9][0-9][0-9][0-9][0-9][0-9][0-9][0-9][0-9]|184467440[0-6][0-9][0-9][0-9][0-9][0-9][0-9][0-9][0-9][0-9][0-9]|1844674407[0-2][0-9][0-9][0-9][0-9][0-9][0-9][0-9][0-9][0-9]|18446744073[0-6][0-9][0-9][0-9][0-9][0-9][0-9][0-9][0-9]|1844674407370[0-8][0-9][0-9][0-9][0-9][0-9][0-9]|18446744073709[0-4][0-9][0-9][0-9][0-9][0-9]|184467440737095[0-4][0-9][0-9][0-9][0-9]|1844674407370955[0-0][0-9][0-9][0-9]|18446744073709551[0-5][0-9][0-9]|184467440737095516[0-0][0-9]|1844674407370955161[0-4]|18446744073709551615))$"
    },
    "safeInt": {
      "type": "integer",
      "minimum": 0,
      "maximum": 9007199254740991
    },
    "number": {
      "type": "number"
    },
    "game": {
      "type": "object",
      "additionalProperties": false,
      "required": [
        "seed",
        "target_seat",
        "result",
        "ticks",
        "collision_causes",
        "replay_file"
      ],
      "properties": {
        "seed": {
          "$ref": "#/$defs/u64"
        },
        "target_seat": {
          "type": "integer",
          "enum": [
            0,
            1
          ]
        },
        "result": {
          "enum": [
            "win",
            "draw",
            "loss"
          ]
        },
        "ticks": {
          "$ref": "#/$defs/safeInt"
        },
        "collision_causes": {
          "type": "array",
          "uniqueItems": true,
          "items": {
            "enum": [
              "out_of_bounds",
              "occupied_trail",
              "occupied_head",
              "same_destination",
              "head_swap",
              "invalid_action",
              "reverse_action"
            ]
          }
        },
        "replay_file": {
          "type": "string",
          "minLength": 1
        }
      }
    },
    "matchup": {
      "type": "object",
      "additionalProperties": false,
      "required": [
        "opponent_id",
        "games",
        "summary"
      ],
      "properties": {
        "opponent_id": {
          "$ref": "#/$defs/id"
        },
        "games": {
          "type": "array",
          "minItems": 64,
          "maxItems": 64,
          "items": {
            "$ref": "#/$defs/game"
          }
        },
        "summary": {
          "type": "object",
          "additionalProperties": false,
          "required": [
            "wins",
            "draws",
            "losses",
            "win_rate",
            "wilson_95",
            "mean_survival_ticks",
            "median_survival_ticks",
            "collision_causes"
          ],
          "properties": {
            "wins": {
              "$ref": "#/$defs/safeInt"
            },
            "draws": {
              "$ref": "#/$defs/safeInt"
            },
            "losses": {
              "$ref": "#/$defs/safeInt"
            },
            "win_rate": {
              "type": "number",
              "minimum": 0,
              "maximum": 1
            },
            "wilson_95": {
              "type": "array",
              "minItems": 2,
              "maxItems": 2,
              "items": {
                "type": "number",
                "minimum": 0,
                "maximum": 1
              }
            },
            "mean_survival_ticks": {
              "type": "number",
              "minimum": 0
            },
            "median_survival_ticks": {
              "type": "number",
              "minimum": 0
            },
            "collision_causes": {
              "type": "object"
            }
          }
        }
      }
    }
  }
}
