{"checkpoint_id":"step-200","format":"lc-eval/1","held_out_seeds":["0","1","2","3","4","5","6","7","8","9","10","11","12","13","14","15","16","17","18","19","20","21","22","23","24","25","26","27","28","29","30","31"],"matchups":[{"games":[{"collision_causes":["occupied_trail"],"replay_file":"evaluation/replays/open-space-00-0.json","result":"loss","seed":"0","target_seat":0,"ticks":12},{"collision_causes":["occupied_trail"],"replay_file":"evaluation/replays/open-space-00-1.json","result":"loss","seed":"0","target_seat":1,"ticks":22},{"collision_causes":["occupied_trail"],"replay_file":"evaluation/replays/open-space-01-0.json","result":"loss","seed":"1","target_seat":0,"ticks":23},{"collision_causes":["occupied_trail"],"replay_file":"evaluation/replays/open-space-01-1.json","result":"loss","seed":"1","target_seat":1,"ticks":22},{"collision_causes":["out_of_bounds"],"replay_file":"evaluation/replays/open-space-02-0.json","result":"loss","seed":"2","target_seat":0,"ticks":18},{"collision_causes":["occupied_trail"],"replay_file":"evaluation/replays/open-space-02-1.json","result":"loss","seed":"2","target_seat":1,"ticks":25},{"collision_causes":["occupied_trail"],"replay_file":"evaluation/replays/open-space-03-0.json","result":"loss","seed":"3","target_seat":0,"ticks":22},{"collision_causes":["occupied_trail"],"replay_file":"evaluation/replays/open-space-03-1.json","result":"loss","seed":"3","target_seat":1,"ticks":18},{"collision_causes":["occupied_trail"],"replay_file":"evaluation/replays/open-space-04-0.json","result":"loss","seed":"4","target_seat":0,"ticks":26},{"collision_causes":["out_of_bounds"],"replay_file":"evaluation/replays/open-space-04-1.json","result":"loss","seed":"4","target_seat":1,"ticks":20},{"collision_causes":["occupied_head"],"replay_file":"evaluation/replays/open-space-05-0.json","result":"loss","seed":"5","target_seat":0,"ticks":9},{"collision_causes":["occupied_trail"],"replay_file":"evaluation/replays/open-space-05-1.json","result":"loss","seed":"5","target_seat":1,"ticks":17},{"collision_causes":["occupied_trail"],"replay_file":"evaluation/replays/open-space-06-0.json","result":"loss","seed":"6","target_seat":0,"ticks":22},{"collision_causes":["occupied_trail"],"replay_file":"evaluation/replays/open-space-06-1.json","result":"loss","seed":"6","target_seat":1,"ticks":17},{"collision_causes":["occupied_head"],"replay_file":"evaluation/replays/open-space-07-0.json","result":"loss","seed":"7","target_seat":0,"ticks":11},{"collision_causes":["occupied_trail"],"replay_file":"evaluation/replays/open-space-07-1.json","result":"loss","seed":"7","target_seat":1,"ticks":25},{"collision_causes":["occupied_trail"],"replay_file":"evaluation/replays/open-space-08-0.json","result":"loss","seed":"8","target_seat":0,"ticks":30},{"collision_causes":["occupied_trail"],"replay_file":"evaluation/replays/open-space-08-1.json","result":"loss","seed":"8","target_seat":1,"ticks":31},{"collision_causes":["occupied_trail"],"replay_file":"evaluation/replays/open-space-09-0.json","result":"loss","seed":"9","target_seat":0,"ticks":17},{"collision_causes":["occupied_trail"],"replay_file":"evaluation/replays/open-space-09-1.json","result":"loss","seed":"9","target_seat":1,"ticks":18},{"collision_causes":["occupied_trail"],"replay_file":"evaluation/replays/open-space-10-0.json","result":"loss","seed":"10","target_seat":0,"ticks":13},{"collision_causes":["occupied_trail"],"replay_file":"evaluation/replays/open-space-10-1.json","result":"loss","seed":"10","target_seat":1,"ticks":11},{"collision_causes":["occupied_trail"],"replay_file":"evaluation/replays/open-space-11-0.json","result":"loss","seed":"11","target_seat":0,"ticks":10},{"collision_causes":["occupied_trail"],"replay_file":"evaluation/replays/open-space-11-1.json","result":"loss","seed":"11","target_seat":1,"ticks":14},{"collision_causes":["occupied_trail"],"replay_file":"evaluation/replays/open-space-12-0.json","result":"loss","seed":"12","target_seat":0,"ticks":23},{"collision_causes":["occupied_trail"],"replay_file":"evaluation/replays/open-space-12-1.json","result":"loss","seed":"12","target_seat":1,"ticks":4},{"collision_causes":["occupied_trail"],"replay_file":"evaluation/replays/open-space-13-0.json","result":"loss","seed":"13","target_seat":0,"ticks":15},{"collision_causes":["occupied_trail"],"replay_file":"evaluation/replays/open-space-13-1.json","result":"loss","seed":"13","target_seat":1,"ticks":17},{"collision_causes":["occupied_trail"],"replay_file":"evaluation/replays/open-space-14-0.json","result":"loss","seed":"14","target_seat":0,"ticks":23},{"collision_causes":["occupied_trail"],"replay_file":"evaluation/replays/open-space-14-1.json","result":"loss","seed":"14","target_seat":1,"ticks":13},{"collision_causes":["occupied_trail"],"replay_file":"evaluation/replays/open-space-15-0.json","result":"loss","seed":"15","target_seat":0,"ticks":34},{"collision_causes":["out_of_bounds"],"replay_file":"evaluation/replays/open-space-15-1.json","result":"loss","seed":"15","target_seat":1,"ticks":19},{"collision_causes":["same_destination"],"replay_file":"evaluation/replays/open-space-16-0.json","result":"draw","seed":"16","target_seat":0,"ticks":21},{"collision_causes":["occupied_trail"],"replay_file":"evaluation/replays/open-space-16-1.json","result":"loss","seed":"16","target_seat":1,"ticks":25},{"collision_causes":["occupied_trail"],"replay_file":"evaluation/replays/open-space-17-0.json","result":"loss","seed":"17","target_seat":0,"ticks":21},{"collision_causes":["occupied_trail"],"replay_file":"evaluation/replays/open-space-17-1.json","result":"loss","seed":"17","target_seat":1,"ticks":35},{"collision_causes":["occupied_trail"],"replay_file":"evaluation/replays/open-space-18-0.json","result":"loss","seed":"18","target_seat":0,"ticks":26},{"collision_causes":["occupied_trail"],"replay_file":"evaluation/replays/open-space-18-1.json","result":"loss","seed":"18","target_seat":1,"ticks":13},{"collision_causes":["occupied_head"],"replay_file":"evaluation/replays/open-space-19-0.json","result":"loss","seed":"19","target_seat":0,"ticks":2},{"collision_causes":["occupied_trail"],"replay_file":"evaluation/replays/open-space-19-1.json","result":"loss","seed":"19","target_seat":1,"ticks":6},{"collision_causes":["occupied_trail"],"replay_file":"evaluation/replays/open-space-20-0.json","result":"loss","seed":"20","target_seat":0,"ticks":21},{"collision_causes":["occupied_trail"],"replay_file":"evaluation/replays/open-space-20-1.json","result":"loss","seed":"20","target_seat":1,"ticks":15},{"collision_causes":["occupied_head"],"replay_file":"evaluation/replays/open-space-21-0.json","result":"loss","seed":"21","target_seat":0,"ticks":20},{"collision_causes":["occupied_trail"],"replay_file":"evaluation/replays/open-space-21-1.json","result":"loss","seed":"21","target_seat":1,"ticks":28},{"collision_causes":["occupied_trail"],"replay_file":"evaluation/replays/open-space-22-0.json","result":"loss","seed":"22","target_seat":0,"ticks":15},{"collision_causes":["same_destination"],"replay_file":"evaluation/replays/open-space-22-1.json","result":"draw","seed":"22","target_seat":1,"ticks":15},{"collision_causes":["occupied_trail"],"replay_file":"evaluation/replays/open-space-23-0.json","result":"loss","seed":"23","target_seat":0,"ticks":30},{"collision_causes":["occupied_trail"],"replay_file":"evaluation/replays/open-space-23-1.json","result":"loss","seed":"23","target_seat":1,"ticks":15},{"collision_causes":["occupied_trail"],"replay_file":"evaluation/replays/open-space-24-0.json","result":"loss","seed":"24","target_seat":0,"ticks":11},{"collision_causes":["occupied_trail"],"replay_file":"evaluation/replays/open-space-24-1.json","result":"loss","seed":"24","target_seat":1,"ticks":24},{"collision_causes":["occupied_trail"],"replay_file":"evaluation/replays/open-space-25-0.json","result":"loss","seed":"25","target_seat":0,"ticks":28},{"collision_causes":["occupied_trail"],"replay_file":"evaluation/replays/open-space-25-1.json","result":"loss","seed":"25","target_seat":1,"ticks":28},{"collision_causes":["occupied_trail"],"replay_file":"evaluation/replays/open-space-26-0.json","result":"loss","seed":"26","target_seat":0,"ticks":18},{"collision_causes":["occupied_trail"],"replay_file":"evaluation/replays/open-space-26-1.json","result":"loss","seed":"26","target_seat":1,"ticks":20},{"collision_causes":["same_destination"],"replay_file":"evaluation/replays/open-space-27-0.json","result":"draw","seed":"27","target_seat":0,"ticks":13},{"collision_causes":["occupied_trail"],"replay_file":"evaluation/replays/open-space-27-1.json","result":"loss","seed":"27","target_seat":1,"ticks":29},{"collision_causes":["occupied_trail"],"replay_file":"evaluation/replays/open-space-28-0.json","result":"loss","seed":"28","target_seat":0,"ticks":22},{"collision_causes":["same_destination"],"replay_file":"evaluation/replays/open-space-28-1.json","result":"draw","seed":"28","target_seat":1,"ticks":24},{"collision_causes":["out_of_bounds"],"replay_file":"evaluation/replays/open-space-29-0.json","result":"loss","seed":"29","target_seat":0,"ticks":16},{"collision_causes":["occupied_trail"],"replay_file":"evaluation/replays/open-space-29-1.json","result":"loss","seed":"29","target_seat":1,"ticks":24},{"collision_causes":["occupied_trail"],"replay_file":"evaluation/replays/open-space-30-0.json","result":"loss","seed":"30","target_seat":0,"ticks":36},{"collision_causes":["occupied_trail"],"replay_file":"evaluation/replays/open-space-30-1.json","result":"loss","seed":"30","target_seat":1,"ticks":25},{"collision_causes":["out_of_bounds"],"replay_file":"evaluation/replays/open-space-31-0.json","result":"loss","seed":"31","target_seat":0,"ticks":16},{"collision_causes":["occupied_trail"],"replay_file":"evaluation/replays/open-space-31-1.json","result":"loss","seed":"31","target_seat":1,"ticks":16}],"opponent_id":"open-space","summary":{"collision_causes":{"occupied_head":4,"occupied_trail":51,"out_of_bounds":5,"same_